{
  "id": "maths/big_integer/bits",
  "title": "Bit access, ranges, searches, shifts and bitwise operators act on the magnitude",
  "juce_tag": "9.0.4",
  "tolerance": "exact",
  "wp": "WP-1.1-16",
  "ledger_rows": ["juce_core/BigInteger"],
  "docs": [{"page": "BigInteger", "member": "BigInteger", "says": "Values may be negative; storage is sign and magnitude rather than two's complement, which matters when reading bits of a negative value."}, {"page": "BigInteger", "member": "findNextSetBit", "says": "Looks upward from a start index, that index included, for a set bit; -1 when none is found."}, {"page": "BigInteger", "member": "getHighestBit", "says": "Index of the top set bit; -1 for zero."}],
  "values": {
    "zero": {"base": 16, "text": "0"},
    "small": {"base": 16, "text": "12345678"},
    "small_neg": {"base": 16, "text": "-ff"},
    "big_a": {"base": 16, "text": "172505372ef440e5c51e9a508bb1f4c9da653868e6d9ca0bc36c05adb3fc4f6341279a23bef7be506564f3a160712456de76aaadd6b855c6b62bd09e04924d52bc614bedce030297c5e538f12d92a28f17d83ce44e27424458b6b6043106a85f68b6daa8b2a668d605d4017f9ee6725ed09d3a0562d56abd685a48f165d57b00c7f4781ef86f5c8cc1ab"},
    "big_b": {"base": 16, "text": "-17486580790b44045f9429523c4b037d52900977a9f2c943862c199bd3a49d1ce2844948a86c51ce927e89f918590825511600314ac9aee9cf6b978d7d421bb1235c9dc8b64f4e68e5c85bd78d396e0d55fc45228f4bd571b0b41b5669a0729b23994395a774f0147f76f87a640701ad82a1865506aadbf8319b25f81fcec1496e2769e927"}
  },
  "steps": [
    {"op": "getBit", "args": ["zero", 0]},
    {"op": "getBit", "args": ["zero", 1099]},
    {"op": "getHighestBit", "args": ["zero"]},
    {"op": "countNumberOfSetBits", "args": ["zero"]},
    {"op": "setBit", "args": ["zero", 1500, true]},
    {"op": "clearBit", "args": ["zero", 3]},
    {"op": "flipBit", "args": ["zero", 64]},
    {"op": "setRange", "args": ["zero", 60, 70, true]},
    {"op": "setRange", "args": ["zero", 0, 1100, false]},
    {"op": "insertBit", "args": ["zero", 5, true]},
    {"op": "getBitRange", "args": ["zero", 30, 100]},
    {"op": "getBitRangeAsInt", "args": ["zero", 60, 32]},
    {"op": "setBitRangeAsInt", "args": ["zero", 62, 20, 703710]},
    {"op": "findNextSetBit", "args": ["zero", 7]},
    {"op": "findNextClearBit", "args": ["zero", 0]},
    {"op": "shiftLeft", "args": ["zero", 1030]},
    {"op": "shiftRight", "args": ["zero", 3]},
    {"op": "shiftRight", "args": ["zero", 1200]},
    {"op": "getBit", "args": ["small", 0]},
    {"op": "getBit", "args": ["small", 1099]},
    {"op": "getHighestBit", "args": ["small"]},
    {"op": "countNumberOfSetBits", "args": ["small"]},
    {"op": "setBit", "args": ["small", 1500, true]},
    {"op": "clearBit", "args": ["small", 3]},
    {"op": "flipBit", "args": ["small", 64]},
    {"op": "setRange", "args": ["small", 60, 70, true]},
    {"op": "setRange", "args": ["small", 0, 1100, false]},
    {"op": "insertBit", "args": ["small", 5, true]},
    {"op": "getBitRange", "args": ["small", 30, 100]},
    {"op": "getBitRangeAsInt", "args": ["small", 60, 32]},
    {"op": "setBitRangeAsInt", "args": ["small", 62, 20, 703710]},
    {"op": "findNextSetBit", "args": ["small", 7]},
    {"op": "findNextClearBit", "args": ["small", 0]},
    {"op": "shiftLeft", "args": ["small", 1030]},
    {"op": "shiftRight", "args": ["small", 3]},
    {"op": "shiftRight", "args": ["small", 1200]},
    {"op": "getBit", "args": ["small_neg", 0]},
    {"op": "getBit", "args": ["small_neg", 1099]},
    {"op": "getHighestBit", "args": ["small_neg"]},
    {"op": "countNumberOfSetBits", "args": ["small_neg"]},
    {"op": "setBit", "args": ["small_neg", 1500, true]},
    {"op": "clearBit", "args": ["small_neg", 3]},
    {"op": "flipBit", "args": ["small_neg", 64]},
    {"op": "setRange", "args": ["small_neg", 60, 70, true]},
    {"op": "setRange", "args": ["small_neg", 0, 1100, false]},
    {"op": "insertBit", "args": ["small_neg", 5, true]},
    {"op": "getBitRange", "args": ["small_neg", 30, 100]},
    {"op": "getBitRangeAsInt", "args": ["small_neg", 60, 32]},
    {"op": "setBitRangeAsInt", "args": ["small_neg", 62, 20, 703710]},
    {"op": "findNextSetBit", "args": ["small_neg", 7]},
    {"op": "findNextClearBit", "args": ["small_neg", 0]},
    {"op": "shiftLeft", "args": ["small_neg", 1030]},
    {"op": "shiftRight", "args": ["small_neg", 3]},
    {"op": "shiftRight", "args": ["small_neg", 1200]},
    {"op": "getBit", "args": ["big_a", 0]},
    {"op": "getBit", "args": ["big_a", 1099]},
    {"op": "getHighestBit", "args": ["big_a"]},
    {"op": "countNumberOfSetBits", "args": ["big_a"]},
    {"op": "setBit", "args": ["big_a", 1500, true]},
    {"op": "clearBit", "args": ["big_a", 3]},
    {"op": "flipBit", "args": ["big_a", 64]},
    {"op": "setRange", "args": ["big_a", 60, 70, true]},
    {"op": "setRange", "args": ["big_a", 0, 1100, false]},
    {"op": "insertBit", "args": ["big_a", 5, true]},
    {"op": "getBitRange", "args": ["big_a", 30, 100]},
    {"op": "getBitRangeAsInt", "args": ["big_a", 60, 32]},
    {"op": "setBitRangeAsInt", "args": ["big_a", 62, 20, 703710]},
    {"op": "findNextSetBit", "args": ["big_a", 7]},
    {"op": "findNextClearBit", "args": ["big_a", 0]},
    {"op": "shiftLeft", "args": ["big_a", 1030]},
    {"op": "shiftRight", "args": ["big_a", 3]},
    {"op": "shiftRight", "args": ["big_a", 1200]},
    {"op": "getBit", "args": ["big_b", 0]},
    {"op": "getBit", "args": ["big_b", 1099]},
    {"op": "getHighestBit", "args": ["big_b"]},
    {"op": "countNumberOfSetBits", "args": ["big_b"]},
    {"op": "setBit", "args": ["big_b", 1500, true]},
    {"op": "clearBit", "args": ["big_b", 3]},
    {"op": "flipBit", "args": ["big_b", 64]},
    {"op": "setRange", "args": ["big_b", 60, 70, true]},
    {"op": "setRange", "args": ["big_b", 0, 1100, false]},
    {"op": "insertBit", "args": ["big_b", 5, true]},
    {"op": "getBitRange", "args": ["big_b", 30, 100]},
    {"op": "getBitRangeAsInt", "args": ["big_b", 60, 32]},
    {"op": "setBitRangeAsInt", "args": ["big_b", 62, 20, 703710]},
    {"op": "findNextSetBit", "args": ["big_b", 7]},
    {"op": "findNextClearBit", "args": ["big_b", 0]},
    {"op": "shiftLeft", "args": ["big_b", 1030]},
    {"op": "shiftRight", "args": ["big_b", 3]},
    {"op": "shiftRight", "args": ["big_b", 1200]},
    {"op": "bitwiseAnd", "args": ["small", "small_neg"]},
    {"op": "bitwiseOr", "args": ["small", "small_neg"]},
    {"op": "bitwiseXor", "args": ["small", "small_neg"]},
    {"op": "bitwiseAnd", "args": ["big_a", "big_b"]},
    {"op": "bitwiseOr", "args": ["big_a", "big_b"]},
    {"op": "bitwiseXor", "args": ["big_a", "big_b"]},
    {"op": "bitwiseAnd", "args": ["big_b", "small"]},
    {"op": "bitwiseOr", "args": ["big_b", "small"]},
    {"op": "bitwiseXor", "args": ["big_b", "small"]},
    {"op": "bitwiseAnd", "args": ["zero", "big_a"]},
    {"op": "bitwiseOr", "args": ["zero", "big_a"]},
    {"op": "bitwiseXor", "args": ["zero", "big_a"]}
  ],
  "notes": "Bitwise operators on negative operands and the sign kept by shifts are observations; Syrp keeps the left operand's sign (b3_bitwise_keeps_left_sign_syrp_choice)."
}
