{
  "id": "maths/big_integer/arithmetic",
  "title": "Addition, subtraction, multiplication, division, remainder and comparison with zero, negative and >2^1024 operands, including division by zero",
  "juce_tag": "9.0.4",
  "tolerance": "exact",
  "wp": "WP-1.1-16",
  "ledger_rows": ["juce_core/BigInteger"],
  "docs": [{"page": "BigInteger", "member": "operator/", "says": "The quotient of two values."}, {"page": "BigInteger", "member": "divideBy", "says": "Gives the quotient and also hands back the remainder."}, {"page": "BigInteger", "member": "compare", "says": "Signed comparison: below zero, zero or above zero."}],
  "values": {
    "zero": {"base": 16, "text": "0"},
    "neg_one": {"base": 16, "text": "-1"},
    "small": {"base": 16, "text": "12345678"},
    "small_neg": {"base": 16, "text": "-ff"},
    "u64_max": {"base": 16, "text": "ffffffffffffffff"},
    "i64_min": {"base": 16, "text": "-8000000000000000"},
    "pow2_1024": {"base": 16, "text": "10000000000000000000000000000000000000000000000000000000000000000000000000000000000000000000000000000000000000000000000000000000000000000000000000000000000000000000000000000000000000000000000000000000000000000000000000000000000000000000000000000000000000000"},
    "big_a": {"base": 16, "text": "172505372ef440e5c51e9a508bb1f4c9da653868e6d9ca0bc36c05adb3fc4f6341279a23bef7be506564f3a160712456de76aaadd6b855c6b62bd09e04924d52bc614bedce030297c5e538f12d92a28f17d83ce44e27424458b6b6043106a85f68b6daa8b2a668d605d4017f9ee6725ed09d3a0562d56abd685a48f165d57b00c7f4781ef86f5c8cc1ab"},
    "big_b": {"base": 16, "text": "-17486580790b44045f9429523c4b037d52900977a9f2c943862c199bd3a49d1ce2844948a86c51ce927e89f918590825511600314ac9aee9cf6b978d7d421bb1235c9dc8b64f4e68e5c85bd78d396e0d55fc45228f4bd571b0b41b5669a0729b23994395a774f0147f76f87a640701ad82a1865506aadbf8319b25f81fcec1496e2769e927"}
  },
  "steps": [
    {"op": "add", "args": ["small", "small_neg"]},
    {"op": "add", "args": ["big_a", "big_b"]},
    {"op": "add", "args": ["big_b", "small"]},
    {"op": "add", "args": ["zero", "big_a"]},
    {"op": "add", "args": ["u64_max", "u64_max"]},
    {"op": "add", "args": ["i64_min", "neg_one"]},
    {"op": "subtract", "args": ["small", "small_neg"]},
    {"op": "subtract", "args": ["big_a", "big_b"]},
    {"op": "subtract", "args": ["big_b", "small"]},
    {"op": "subtract", "args": ["zero", "big_a"]},
    {"op": "subtract", "args": ["u64_max", "u64_max"]},
    {"op": "subtract", "args": ["i64_min", "neg_one"]},
    {"op": "multiply", "args": ["small", "small_neg"]},
    {"op": "multiply", "args": ["big_a", "big_b"]},
    {"op": "multiply", "args": ["big_b", "small"]},
    {"op": "multiply", "args": ["zero", "big_a"]},
    {"op": "multiply", "args": ["u64_max", "u64_max"]},
    {"op": "multiply", "args": ["i64_min", "neg_one"]},
    {"op": "divide", "args": ["small", "small_neg"]},
    {"op": "divide", "args": ["big_a", "big_b"]},
    {"op": "divide", "args": ["big_b", "small"]},
    {"op": "divide", "args": ["zero", "big_a"]},
    {"op": "divide", "args": ["u64_max", "u64_max"]},
    {"op": "divide", "args": ["i64_min", "neg_one"]},
    {"op": "divide", "args": ["big_a", "zero"]},
    {"op": "divide", "args": ["small_neg", "zero"]},
    {"op": "divide", "args": ["big_b", "pow2_1024"]},
    {"op": "modulo", "args": ["small", "small_neg"]},
    {"op": "modulo", "args": ["big_a", "big_b"]},
    {"op": "modulo", "args": ["big_b", "small"]},
    {"op": "modulo", "args": ["zero", "big_a"]},
    {"op": "modulo", "args": ["u64_max", "u64_max"]},
    {"op": "modulo", "args": ["i64_min", "neg_one"]},
    {"op": "modulo", "args": ["big_a", "zero"]},
    {"op": "modulo", "args": ["small_neg", "zero"]},
    {"op": "modulo", "args": ["big_b", "pow2_1024"]},
    {"op": "divideBy", "args": ["small", "small_neg"]},
    {"op": "divideBy", "args": ["big_a", "big_b"]},
    {"op": "divideBy", "args": ["big_b", "small"]},
    {"op": "divideBy", "args": ["zero", "big_a"]},
    {"op": "divideBy", "args": ["u64_max", "u64_max"]},
    {"op": "divideBy", "args": ["i64_min", "neg_one"]},
    {"op": "divideBy", "args": ["big_a", "zero"]},
    {"op": "divideBy", "args": ["small_neg", "zero"]},
    {"op": "divideBy", "args": ["big_b", "pow2_1024"]},
    {"op": "compare", "args": ["small", "small_neg"]},
    {"op": "compare", "args": ["big_a", "big_b"]},
    {"op": "compare", "args": ["big_b", "small"]},
    {"op": "compare", "args": ["zero", "big_a"]},
    {"op": "compare", "args": ["u64_max", "u64_max"]},
    {"op": "compare", "args": ["i64_min", "neg_one"]}
  ],
  "notes": "Division by zero is included as an observation: the documentation does not define it, and Syrp returns zero (b2_division_by_zero_returns_zero_syrp_choice)."
}
