{
  "id": "maths/big_integer/text_and_bytes",
  "title": "Text in bases 2, 8, 10 and 16 with padding, parsing, and little-endian byte blocks without the sign",
  "juce_tag": "9.0.4",
  "tolerance": "exact",
  "wp": "WP-1.1-16",
  "ledger_rows": ["juce_core/BigInteger"],
  "docs": [{"page": "BigInteger", "member": "toString", "says": "Text in base 2, 8, 10 or 16, zero-padded on the left up to a minimum length."}, {"page": "BigInteger", "member": "parseString", "says": "Reads text written in base 2, 8, 10 or 16."}, {"page": "BigInteger", "member": "toMemoryBlock", "says": "Binary form, low byte first; the sign is not included."}],
  "values": {
    "zero": {"base": 16, "text": "0"},
    "small_neg": {"base": 16, "text": "-ff"},
    "u64_max": {"base": 16, "text": "ffffffffffffffff"},
    "big_a": {"base": 16, "text": "172505372ef440e5c51e9a508bb1f4c9da653868e6d9ca0bc36c05adb3fc4f6341279a23bef7be506564f3a160712456de76aaadd6b855c6b62bd09e04924d52bc614bedce030297c5e538f12d92a28f17d83ce44e27424458b6b6043106a85f68b6daa8b2a668d605d4017f9ee6725ed09d3a0562d56abd685a48f165d57b00c7f4781ef86f5c8cc1ab"},
    "big_b": {"base": 16, "text": "-17486580790b44045f9429523c4b037d52900977a9f2c943862c199bd3a49d1ce2844948a86c51ce927e89f918590825511600314ac9aee9cf6b978d7d421bb1235c9dc8b64f4e68e5c85bd78d396e0d55fc45228f4bd571b0b41b5669a0729b23994395a774f0147f76f87a640701ad82a1865506aadbf8319b25f81fcec1496e2769e927"}
  },
  "steps": [
    {"op": "toString", "args": ["zero", 2, 1]},
    {"op": "toString", "args": ["zero", 8, 1]},
    {"op": "toString", "args": ["zero", 10, 1]},
    {"op": "toString", "args": ["zero", 16, 1]},
    {"op": "toString", "args": ["zero", 16, 300]},
    {"op": "toMemoryBlock", "args": ["zero"]},
    {"op": "toString", "args": ["small_neg", 2, 1]},
    {"op": "toString", "args": ["small_neg", 8, 1]},
    {"op": "toString", "args": ["small_neg", 10, 1]},
    {"op": "toString", "args": ["small_neg", 16, 1]},
    {"op": "toString", "args": ["small_neg", 16, 300]},
    {"op": "toMemoryBlock", "args": ["small_neg"]},
    {"op": "toString", "args": ["u64_max", 2, 1]},
    {"op": "toString", "args": ["u64_max", 8, 1]},
    {"op": "toString", "args": ["u64_max", 10, 1]},
    {"op": "toString", "args": ["u64_max", 16, 1]},
    {"op": "toString", "args": ["u64_max", 16, 300]},
    {"op": "toMemoryBlock", "args": ["u64_max"]},
    {"op": "toString", "args": ["big_a", 2, 1]},
    {"op": "toString", "args": ["big_a", 8, 1]},
    {"op": "toString", "args": ["big_a", 10, 1]},
    {"op": "toString", "args": ["big_a", 16, 1]},
    {"op": "toString", "args": ["big_a", 16, 300]},
    {"op": "toMemoryBlock", "args": ["big_a"]},
    {"op": "toString", "args": ["big_b", 2, 1]},
    {"op": "toString", "args": ["big_b", 8, 1]},
    {"op": "toString", "args": ["big_b", 10, 1]},
    {"op": "toString", "args": ["big_b", 16, 1]},
    {"op": "toString", "args": ["big_b", 16, 300]},
    {"op": "toMemoryBlock", "args": ["big_b"]},
    {"op": "parseString", "args": [{"literal": "-ff"}, 16]},
    {"op": "parseString", "args": [{"literal": "FF"}, 16]},
    {"op": "parseString", "args": [{"literal": "0"}, 10]},
    {"op": "parseString", "args": [{"literal": "-0"}, 10]},
    {"op": "parseString", "args": [{"literal": "777"}, 8]},
    {"op": "parseString", "args": [{"literal": "1011"}, 2]},
    {"op": "parseString", "args": [{"literal": "123456789012345678901234567890123456789"}, 10]},
    {"op": "parseString", "args": [{"literal": "12a"}, 10]},
    {"op": "parseString", "args": [{"literal": "2"}, 2]},
    {"op": "loadFromMemoryBlock", "args": [{"literal": ""}]},
    {"op": "loadFromMemoryBlock", "args": [{"literal": "0201"}]},
    {"op": "loadFromMemoryBlock", "args": [{"literal": "020100000000"}]},
    {"op": "loadFromMemoryBlock", "args": [{"literal": "ffffffffffffffffffffffffffffffffffffffffffffffffffffffffffffffffffffffffffffffffffffffffffffffffffffffffffffffffffffffffffffffffffffffffffffffffffffffffffffffffffffffffffffffffffffffffffffffffffffffffffffffffffffffffffffffffffffffffffffffffffffffffffffffffffffffffffffffffffffffff"}]}
  ],
  "notes": "Where the minus sign goes relative to the padding, the case of hex digits and what parseString does with an invalid digit are observations; Syrp returns SYRP-MATHS-0002 for invalid digits. loadFromMemoryBlock literals are bytes in hex, first byte first."
}
