{
  "id": "maths/big_integer/sign_and_conversion",
  "title": "Sign queries, negation and 64-bit conversion; zero is never negative",
  "juce_tag": "9.0.4",
  "tolerance": "exact",
  "wp": "WP-1.1-16",
  "ledger_rows": ["juce_core/BigInteger"],
  "docs": [{"page": "BigInteger", "member": "setNegative", "says": "Makes the value positive or negative, keeping its magnitude."}, {"page": "BigInteger", "member": "toInt64", "says": "Gives the low 64 bits of the value as a signed 64-bit integer."}],
  "values": {
    "zero": {"base": 16, "text": "0"},
    "one": {"base": 16, "text": "1"},
    "neg_one": {"base": 16, "text": "-1"},
    "small": {"base": 16, "text": "12345678"},
    "small_neg": {"base": 16, "text": "-ff"},
    "u64_max": {"base": 16, "text": "ffffffffffffffff"},
    "i64_min": {"base": 16, "text": "-8000000000000000"},
    "big_b": {"base": 16, "text": "-17486580790b44045f9429523c4b037d52900977a9f2c943862c199bd3a49d1ce2844948a86c51ce927e89f918590825511600314ac9aee9cf6b978d7d421bb1235c9dc8b64f4e68e5c85bd78d396e0d55fc45228f4bd571b0b41b5669a0729b23994395a774f0147f76f87a640701ad82a1865506aadbf8319b25f81fcec1496e2769e927"}
  },
  "steps": [
    {"op": "isZero", "args": ["zero"]},
    {"op": "isOne", "args": ["zero"]},
    {"op": "isNegative", "args": ["zero"]},
    {"op": "negate", "args": ["zero"]},
    {"op": "toInt64", "args": ["zero"]},
    {"op": "isZero", "args": ["one"]},
    {"op": "isOne", "args": ["one"]},
    {"op": "isNegative", "args": ["one"]},
    {"op": "negate", "args": ["one"]},
    {"op": "toInt64", "args": ["one"]},
    {"op": "isZero", "args": ["neg_one"]},
    {"op": "isOne", "args": ["neg_one"]},
    {"op": "isNegative", "args": ["neg_one"]},
    {"op": "negate", "args": ["neg_one"]},
    {"op": "toInt64", "args": ["neg_one"]},
    {"op": "isZero", "args": ["small_neg"]},
    {"op": "isOne", "args": ["small_neg"]},
    {"op": "isNegative", "args": ["small_neg"]},
    {"op": "negate", "args": ["small_neg"]},
    {"op": "toInt64", "args": ["small_neg"]},
    {"op": "isZero", "args": ["u64_max"]},
    {"op": "isOne", "args": ["u64_max"]},
    {"op": "isNegative", "args": ["u64_max"]},
    {"op": "negate", "args": ["u64_max"]},
    {"op": "toInt64", "args": ["u64_max"]},
    {"op": "isZero", "args": ["i64_min"]},
    {"op": "isOne", "args": ["i64_min"]},
    {"op": "isNegative", "args": ["i64_min"]},
    {"op": "negate", "args": ["i64_min"]},
    {"op": "toInt64", "args": ["i64_min"]},
    {"op": "isZero", "args": ["big_b"]},
    {"op": "isOne", "args": ["big_b"]},
    {"op": "isNegative", "args": ["big_b"]},
    {"op": "negate", "args": ["big_b"]},
    {"op": "toInt64", "args": ["big_b"]},
    {"op": "setNegative", "args": ["zero", true]},
    {"op": "setNegative", "args": ["small", true]},
    {"op": "setNegative", "args": ["big_b", false]}
  ],
  "notes": "toInt64 on values above 64 bits is recorded as an observation; Syrp returns None there (checked conversion)."
}
